{
  "receipt_id": "f9d6bc38-4c78-4b8d-abc7-ae67551e41e0",
  "receipt_type": "governed_action",
  "intent_id": "b2c3d4e5-f6a7-8901-bcde-f12345678901",
  "action": "execute_trade",
  "agent_id": "trading-agent-007",
  "authorized_by": "HUMAN:brian@rio-one.io",
  "timestamp": "2026-04-02T04:08:58.286Z",
  "hash_chain": {
    "intent_hash": "475cbd21dda01ec7790aec52dfcad038b538671bef1d56cd5c9460c0716efeb9",
    "governance_hash": "ae65afab8c95f7fa2ee6bf7faa89871ace118081bea348eb0528ec05591cc4a3",
    "authorization_hash": "a489e974c7e1286b59c1d7f794f8946bb2e5cac733892212103d2b2f3d3f4a9e",
    "execution_hash": "259e3205a9eb33e537e0ca260fb0f02231e92d716d60cf4d552ede8336456b84",
    "receipt_hash": "22c4d75db3ef389b66ccb13ecbb2c0656ad0e8abc881d7f348332fe0e8fb238e"
  },
  "verification": {
    "algorithm": "SHA-256",
    "chain_length": 5,
    "chain_order": [
      "intent_hash",
      "governance_hash",
      "authorization_hash",
      "execution_hash",
      "receipt_hash"
    ]
  }
}
